{
  "version": "1.0",
  "character": "Henry",
  "composition": "waist_up",
  "canvas": {
    "width": 512,
    "height": 512,
    "anchor_x": 0.5,
    "anchor_y": 0.92
  },
  "transition_source": {
    "sheet": "01_loop_core_idle_listening_thinking.png",
    "boxes": [
      [34, 127, 300, 383]
    ]
  },
  "states": {
    "idle": {
      "sheet": "03_reaction_happy_laugh.png",
      "boxes": [
        [18, 88, 194, 353],
        [195, 88, 370, 353],
        [371, 88, 547, 353],
        [548, 88, 723, 353],
        [724, 88, 900, 353],
        [901, 88, 1076, 353],
        [1077, 88, 1253, 353],
        [1254, 88, 1429, 353]
      ]
    },
    "listening": {
      "sheet": "03_reaction_happy_laugh.png",
      "boxes": [
        [18, 445, 194, 700],
        [195, 445, 370, 700],
        [371, 445, 547, 700],
        [548, 445, 723, 700],
        [724, 445, 900, 700],
        [901, 445, 1076, 700],
        [1077, 445, 1253, 700],
        [1254, 445, 1429, 700]
      ]
    },
    "thinking": {
      "sheet": "03_reaction_happy_laugh.png",
      "boxes": [
        [18, 790, 194, 1051],
        [195, 790, 370, 1051],
        [371, 790, 547, 1051],
        [548, 790, 723, 1051],
        [724, 790, 900, 1051],
        [901, 790, 1076, 1051],
        [1077, 790, 1253, 1051],
        [1254, 790, 1429, 1051]
      ]
    },
    "speaking": {
      "sheet": "04_gesture_keyframes.png",
      "boxes": [
        [18, 230, 159, 482],
        [159, 230, 300, 482],
        [300, 230, 441, 482],
        [441, 230, 582, 482],
        [582, 230, 723, 482],
        [723, 230, 864, 482],
        [864, 230, 1005, 482],
        [1005, 230, 1146, 482],
        [1146, 230, 1287, 482],
        [1287, 230, 1428, 482]
      ]
    },
    "happy": {
      "sheet": "01_loop_core_idle_listening_thinking.png",
      "boxes": [
        [34, 438, 300, 690]
      ]
    },
    "error": {
      "sheet": "01_loop_core_idle_listening_thinking.png",
      "boxes": [
        [886, 745, 1144, 1004]
      ]
    }
  }
}
